{
  "schema_version": "validator-handoff.v1",
  "task_id": "TASK-20260430-001",
  "agent": "Validator-B",
  "invocation": {
    "runtime": "Gemini CLI",
    "fresh_session_required": true,
    "sandbox": "read-only",
    "approval_policy": "never"
  },
  "refs": {
    "spec": "tasks/specs/TASK-20260430-001.json",
    "ledger": "logs/tasks/TASK-20260430-001.jsonl",
    "generator_result": "tasks/handoffs/TASK-20260430-001/generator-result.json"
  },
  "changed_files": [
    "scripts/run-validator-b.mjs",
    "package.json",
    "scripts/audit-harness.mjs",
    "scripts/validate-handoffs.mjs"
  ],
  "success_criteria": [
    "package.json exposes a run:validator-b command.",
    "scripts/run-validator-b.mjs exists and can execute in dry-run mode without invoking Gemini.",
    "Validator-B runner rejects handoffs with agent values other than Validator-B.",
    "Validator-B runner performs common secret-like payload preflight before invoking a model CLI.",
    "Harness audit includes Validator-B pipeline checks."
  ],
  "known_risks": [
    "Gemini CLI is not installed in the current local environment, so live execution may produce Resource Failure until configured.",
    "Validator-B must stay independent from Validator-A results in Tier 3."
  ],
  "forbidden_context": [
    "Do not include Validator-A result artifacts in this handoff.",
    "Do not include secrets, credentials, API keys, tokens, or PII.",
    "Do not ask Validator-B to modify files or merge branches."
  ],
  "expected_output_path": "tasks/handoffs/TASK-20260430-001/validator-b-result-1.json",
  "expected_output_schema": "docs/schemas/validator-result.schema.json"
}
